{
  "id": "QZ-L-001-06-A",
  "lessonId": "L-001-06",
  "officialQuestionIds": [
    "B-001-023-001",
    "B-001-023-002",
    "B-001-023-003",
    "B-001-023-004",
    "B-001-023-005",
    "B-001-023-006",
    "B-001-023-007",
    "B-001-023-008",
    "B-001-023-009",
    "B-001-023-010",
    "B-001-024-001",
    "B-001-024-002",
    "B-001-024-003",
    "B-001-024-004",
    "B-001-024-005",
    "B-001-024-006",
    "B-001-024-007",
    "B-001-024-008",
    "B-001-024-009",
    "B-001-024-010",
    "B-001-025-001",
    "B-001-025-002",
    "B-001-025-003",
    "B-001-025-004"
  ],
  "conceptChecks": [
    {
      "id": "QZ-L-001-06-A-C1",
      "prompt": {
        "en": "A project folder has one tab for the local process and one tab for CPC-2-0-03. What is the best two-step use of those tabs?",
        "fr": null
      },
      "choices": [
        {
          "text": {
            "en": "Check the local-process tab for municipal instructions, check the CPC tab as ISED antenna-siting material, then choose the process path from those sources",
            "fr": null
          },
          "isCorrect": true
        },
        {
          "text": {
            "en": "Use the CPC tab only after the municipality has rejected every local exclusion",
            "fr": null
          },
          "isCorrect": false
        },
        {
          "text": {
            "en": "Merge both tabs into one rule that requires a matching exclusion in both sources every time",
            "fr": null
          },
          "isCorrect": false
        },
        {
          "text": {
            "en": "File CPC-2-0-03 as a Health Canada RF exposure document instead of an antenna-siting procedure",
            "fr": null
          },
          "isCorrect": false
        }
      ],
      "explanation": {
        "en": "The lesson separates municipal process material from ISED antenna-siting material. CPC-2-0-03 belongs with antenna consultation, not with Health Canada RF exposure or EMCAB-2 complaint handling.",
        "fr": null
      }
    },
    {
      "id": "QZ-L-001-06-A-C2",
      "prompt": {
        "en": "Which note about Safety Code 6 is NOT true?",
        "fr": null
      },
      "choices": [
        {
          "text": {
            "en": "It is the Health Canada exposure guideline named in this lesson",
            "fr": null
          },
          "isCorrect": false
        },
        {
          "text": {
            "en": "It deals with limits for people exposed to RF energy",
            "fr": null
          },
          "isCorrect": false
        },
        {
          "text": {
            "en": "It is the EMCAB-2 procedure for deciding interference complaints at affected premises",
            "fr": null
          },
          "isCorrect": true
        },
        {
          "text": {
            "en": "It is separate from the antenna-siting consultation path",
            "fr": null
          },
          "isCorrect": false
        }
      ],
      "explanation": {
        "en": "Safety Code 6 is the RF exposure guideline. EMCAB-2 is the separate field-strength framework used for electromagnetic compatibility complaints.",
        "fr": null
      }
    },
    {
      "id": "QZ-L-001-06-A-C3",
      "prompt": {
        "en": "A troubleshooting sheet says, 'If the affected device is in a home, use the associated-equipment category and do not read the device type.' What error should you spot?",
        "fr": null
      },
      "choices": [
        {
          "text": {
            "en": "Associated equipment is not a catch-all for every household device; identify the equipment category before applying the criterion",
            "fr": null
          },
          "isCorrect": true
        },
        {
          "text": {
            "en": "Associated equipment is never used for home-entertainment devices",
            "fr": null
          },
          "isCorrect": false
        },
        {
          "text": {
            "en": "Equipment category matters only for antenna-siting consultation",
            "fr": null
          },
          "isCorrect": false
        },
        {
          "text": {
            "en": "Once field strength is measured, the equipment category can always be ignored",
            "fr": null
          },
          "isCorrect": false
        }
      ],
      "explanation": {
        "en": "EMCAB-2 uses equipment categories as part of choosing the applicable field-strength criterion; the lesson does not make associated equipment a universal household label.",
        "fr": null
      }
    }
  ]
}
