{
  "id": "QZ-L-002-02-A",
  "lessonId": "L-002-02",
  "officialQuestionIds": [
    "B-002-005-001",
    "B-002-005-002",
    "B-002-005-003",
    "B-002-005-004",
    "B-002-005-005",
    "B-002-005-006",
    "B-002-005-007",
    "B-002-005-008",
    "B-002-005-009",
    "B-002-005-010",
    "B-002-005-011",
    "B-002-006-001",
    "B-002-006-002",
    "B-002-006-003",
    "B-002-006-004",
    "B-002-006-005",
    "B-002-006-006",
    "B-002-006-007",
    "B-002-006-008",
    "B-002-006-009",
    "B-002-006-010",
    "B-002-006-011",
    "B-002-007-001",
    "B-002-007-002",
    "B-002-007-003",
    "B-002-007-004",
    "B-002-007-005",
    "B-002-007-006",
    "B-002-007-007",
    "B-002-007-008",
    "B-002-007-009",
    "B-002-007-010",
    "B-002-007-011"
  ],
  "conceptChecks": [
    {
      "id": "QZ-L-002-02-A-C1",
      "prompt": {
        "en": "You called CQ at 15 words per minute even though you copy new calls at 9, and the answering station comes back too fast. What combined response is best?",
        "fr": null
      },
      "choices": [
        {
          "text": {
            "en": "Ask for slower sending now, then make future CQs at a speed you can receive accurately.",
            "fr": null
          },
          "isCorrect": true
        },
        {
          "text": {
            "en": "Keep sending at 15 because a clean keyer setting proves the reply will be copyable.",
            "fr": null
          },
          "isCorrect": false
        },
        {
          "text": {
            "en": "Change frequency without explanation, because QSY is the normal request for slower code.",
            "fr": null
          },
          "isCorrect": false
        },
        {
          "text": {
            "en": "Send a higher RST strength report so the other station knows to slow down.",
            "fr": null
          },
          "isCorrect": false
        }
      ],
      "explanation": {
        "en": "QRS handles the immediate too-fast reply, and the CQ speed rule prevents causing the same problem in the next call.",
        "fr": null
      }
    },
    {
      "id": "QZ-L-002-02-A-C2",
      "prompt": {
        "en": "Before calling CQ on CW, you send QRL? and hear static crashes plus a weak station fragment. Which decision best combines the Q-signal rules?",
        "fr": null
      },
      "choices": [
        {
          "text": {
            "en": "Recognize the static as QRN, but do not call CQ until you are satisfied the frequency is not in use.",
            "fr": null
          },
          "isCorrect": true
        },
        {
          "text": {
            "en": "Treat QRN as permission to transmit because static means no station can be using the frequency.",
            "fr": null
          },
          "isCorrect": false
        },
        {
          "text": {
            "en": "Send QRZ? because any weak fragment before your CQ must be someone calling you.",
            "fr": null
          },
          "isCorrect": false
        },
        {
          "text": {
            "en": "Send QSY as the first call, because changing frequency is the same as checking whether one is busy.",
            "fr": null
          },
          "isCorrect": false
        }
      ],
      "explanation": {
        "en": "QRN describes static trouble, while QRL? is the busy-frequency check. Noise does not cancel the need to protect a frequency that may already be occupied.",
        "fr": null
      }
    },
    {
      "id": "QZ-L-002-02-A-C3",
      "prompt": {
        "en": "A Morse test signal drops one S-unit after the receiving station changes antennas, and the note also becomes rough. Which report reasoning is best?",
        "fr": null
      },
      "choices": [
        {
          "text": {
            "en": "Do not infer a transmitter-power change from the S-meter, but do reflect the rough note in the tone part of RST.",
            "fr": null
          },
          "isCorrect": true
        },
        {
          "text": {
            "en": "Calculate one-quarter transmitter power and keep tone perfect because S-meter readings decide all RST digits.",
            "fr": null
          },
          "isCorrect": false
        },
        {
          "text": {
            "en": "Remove the tone digit because any antenna change turns a Morse report into a voice report.",
            "fr": null
          },
          "isCorrect": false
        },
        {
          "text": {
            "en": "Raise the readability digit automatically because a lower S-meter proves the signal is easier to understand.",
            "fr": null
          },
          "isCorrect": false
        }
      ],
      "explanation": {
        "en": "The S-unit power shortcut requires unchanged conditions, and RST has separate observations. A changed antenna breaks the power inference; a rough Morse note belongs in tone quality.",
        "fr": null
      }
    }
  ]
}
