{
  "id": "QZ-L-003-07-A",
  "lessonId": "L-003-07",
  "officialQuestionIds": [
    "B-003-016-003",
    "B-003-016-006",
    "B-003-016-007",
    "B-003-016-009",
    "B-003-016-011",
    "B-003-017-003",
    "B-003-017-005",
    "B-003-017-011"
  ],
  "conceptChecks": [
    {
      "id": "QZ-L-003-07-A-C1",
      "prompt": { "en": "A planning note says two matched 9 Ah packs in series give twice the voltage and 18 Ah. What error should you spot?", "fr": null },
      "choices": [
        { "text": { "en": "The voltage would not add in a series string", "fr": null }, "isCorrect": false },
        { "text": { "en": "The ampere-hour capacity of one series string stays at 9 Ah", "fr": null }, "isCorrect": true },
        { "text": { "en": "Voltage can add only when both packs use lithium chemistry", "fr": null }, "isCorrect": false },
        { "text": { "en": "Polarity stops mattering once packs are wired in series", "fr": null }, "isCorrect": false }
      ],
      "explanation": { "en": "Series wiring adds voltage, but one matched series string keeps the ampere-hour rating of one pack. Chemistry and polarity still matter.", "fr": null }
    },
    {
      "id": "QZ-L-003-07-A-C2",
      "prompt": { "en": "The same battery and DC leads are used, but transmit current is twice the planned value. What should you predict at the radio input?", "fr": null },
      "choices": [
        { "text": { "en": "The input voltage rises because the battery capacity is being used faster", "fr": null }, "isCorrect": false },
        { "text": { "en": "Only AC ripple changes; DC lead resistance is unaffected by current", "fr": null }, "isCorrect": false },
        { "text": { "en": "The input voltage falls more because resistance drops more voltage at higher current", "fr": null }, "isCorrect": true },
        { "text": { "en": "The fuse current rating should be increased to hold the voltage steady", "fr": null }, "isCorrect": false }
      ],
      "explanation": { "en": "Internal resistance and lead resistance cause voltage drop proportional to current, so a higher transmit current leaves less voltage at the radio. A larger fuse does not fix voltage drop.", "fr": null }
    },
    {
      "id": "QZ-L-003-07-A-C3",
      "prompt": { "en": "A supply has enough current headroom, so the buyer skips any RF-noise check and assumes the station will be clean. What is the mistake?", "fr": null },
      "choices": [
        { "text": { "en": "Extra current headroom proves the output voltage will be correct under every load", "fr": null }, "isCorrect": false },
        { "text": { "en": "A linear supply is automatically unsafe because it is less efficient", "fr": null }, "isCorrect": false },
        { "text": { "en": "A larger fuse current rating is the normal RF-noise filter", "fr": null }, "isCorrect": false },
        { "text": { "en": "Load rating and RF-noise behaviour are separate checks", "fr": null }, "isCorrect": true }
      ],
      "explanation": { "en": "A supply can meet the current requirement and still be noisy. Load capacity, fuse protection, and RF-noise behaviour must be considered separately.", "fr": null }
    }
  ]
}
