{
  "id": "QZ-L-008-02-A",
  "lessonId": "L-008-02",
  "officialQuestionIds": [
    "B-008-004-002",
    "B-008-004-005",
    "B-008-004-006",
    "B-008-004-008",
    "B-008-004-010",
    "B-008-005-002",
    "B-008-005-007",
    "B-008-005-009"
  ],
  "conceptChecks": [
    {
      "id": "QZ-L-008-02-A-C1",
      "prompt": { "en": "A service monitor shows a transmitter operating at 4.8 MHz and an unwanted output at 14.4 MHz. Which explanation best fits the relationship?", "fr": null },
      "choices": [
        { "text": { "en": "It is the second harmonic of the actual 4.8 MHz operating frequency.", "fr": null }, "isCorrect": false },
        { "text": { "en": "It is adjacent-channel splatter from an overmodulated voice signal.", "fr": null }, "isCorrect": false },
        { "text": { "en": "It is the third harmonic, because 4.8 x 3 = 14.4.", "fr": null }, "isCorrect": true },
        { "text": { "en": "It is a receiver notch-filter response rather than a transmitter output.", "fr": null }, "isCorrect": false }
      ],
      "explanation": { "en": "A harmonic is an integer multiple of the fundamental; 14.4 divided by 4.8 equals 3.", "fr": null }
    },
    {
      "id": "QZ-L-008-02-A-C2",
      "prompt": { "en": "A receiver must keep monitoring 3.9 MHz and 5.3 MHz, but a strong industrial controller produces RF across 4.45 to 4.65 MHz. Which filter family best matches that goal?", "fr": null },
      "choices": [
        { "text": { "en": "Notch, aimed at one carrier in the middle of the controller's range.", "fr": null }, "isCorrect": false },
        { "text": { "en": "Band-reject, because it can attenuate the controller's range while passing frequencies below and above it.", "fr": null }, "isCorrect": true },
        { "text": { "en": "Low-pass with a cut-off just above the 3.9 MHz signal.", "fr": null }, "isCorrect": false },
        { "text": { "en": "High-pass with a cut-off just below the 5.3 MHz signal.", "fr": null }, "isCorrect": false }
      ],
      "explanation": { "en": "The unwanted energy occupies a middle range while wanted signals are on both sides, so a band-reject filter fits better than a notch, low-pass, or high-pass filter.", "fr": null }
    },
    {
      "id": "QZ-L-008-02-A-C3",
      "prompt": { "en": "A station on 14.230 MHz is clean during tuning tones, but during loud voice syllables a monitor 3 kHz away hears rough bursts on both sides of the signal. Which explanation best fits?", "fr": null },
      "choices": [
        { "text": { "en": "Harmonic emission, because the unwanted energy is at an integer multiple of 14.230 MHz.", "fr": null }, "isCorrect": false },
        { "text": { "en": "Receiver desensitization, because the monitor front end is losing sensitivity across all bands.", "fr": null }, "isCorrect": false },
        { "text": { "en": "Splatter from overmodulation or other non-linear voice peaks near the transmit frequency.", "fr": null }, "isCorrect": true },
        { "text": { "en": "A notch-filter problem, because one narrow carrier is being removed from the passband.", "fr": null }, "isCorrect": false }
      ],
      "explanation": { "en": "Bursts only a few kilohertz from the SSB signal during loud syllables point to splatter from non-linear modulation, not a distant harmonic or a receiver filter choice.", "fr": null }
    }
  ]
}
