{
  "id": "QZ-L-002-01-A",
  "lessonId": "L-002-01",
  "officialQuestionIds": [
    "B-002-001-001",
    "B-002-001-002",
    "B-002-001-003",
    "B-002-001-004",
    "B-002-001-005",
    "B-002-001-006",
    "B-002-001-007",
    "B-002-001-008",
    "B-002-001-009",
    "B-002-001-010",
    "B-002-001-011",
    "B-002-002-001",
    "B-002-002-002",
    "B-002-002-003",
    "B-002-002-004",
    "B-002-002-005",
    "B-002-002-006",
    "B-002-002-007",
    "B-002-002-008",
    "B-002-002-009",
    "B-002-002-010",
    "B-002-002-011",
    "B-002-003-001",
    "B-002-003-002",
    "B-002-003-003",
    "B-002-003-004",
    "B-002-003-005",
    "B-002-003-006",
    "B-002-003-007",
    "B-002-003-008",
    "B-002-003-009",
    "B-002-003-010",
    "B-002-003-011",
    "B-002-004-001",
    "B-002-004-002",
    "B-002-004-003",
    "B-002-004-004",
    "B-002-004-005",
    "B-002-004-006",
    "B-002-004-007",
    "B-002-004-008",
    "B-002-004-009",
    "B-002-004-010",
    "B-002-004-011"
  ],
  "conceptChecks": [
    {
      "id": "QZ-L-002-01-A-C1",
      "prompt": {
        "en": "A newly coordinated repeater has a published channel pair, but users still cannot bring it up unless their radios send the required access tone. Which explanation combines both facts?",
        "fr": null
      },
      "choices": [
        {
          "text": {
            "en": "Coordination helps reduce channel conflicts; the programmed transmit CTCSS tone is still needed to open that receiver.",
            "fr": null
          },
          "isCorrect": true
        },
        {
          "text": {
            "en": "Coordination automatically inserts the access tone into every user radio in the coverage area.",
            "fr": null
          },
          "isCorrect": false
        },
        {
          "text": {
            "en": "A CTCSS tone replaces frequency coordination, so the repeater channel pair no longer matters.",
            "fr": null
          },
          "isCorrect": false
        },
        {
          "text": {
            "en": "The access tone changes the repeater into simplex operation whenever the channel is busy.",
            "fr": null
          },
          "isCorrect": false
        }
      ],
      "explanation": {
        "en": "Coordination and CTCSS solve different problems. Coordination plans repeater channels; the access tone is a receiver-opening condition for users.",
        "fr": null
      }
    },
    {
      "id": "QZ-L-002-01-A-C2",
      "prompt": {
        "en": "Which statement is NOT true about repeater access and shared-channel courtesy?",
        "fr": null
      },
      "choices": [
        {
          "text": {
            "en": "A required transmit CTCSS tone must be sent by your radio for the repeater receiver to open correctly.",
            "fr": null
          },
          "isCorrect": false
        },
        {
          "text": {
            "en": "A time-out timer is a backstop for excessive transmissions, not permission to hold the channel until it stops you.",
            "fr": null
          },
          "isCorrect": false
        },
        {
          "text": {
            "en": "A fallback plan helps when two stations try simplex and the direct channel is unusable.",
            "fr": null
          },
          "isCorrect": false
        },
        {
          "text": {
            "en": "If you hear the repeater output strongly, the transmit offset and transmit tone can no longer affect whether others hear you.",
            "fr": null
          },
          "isCorrect": true
        }
      ],
      "explanation": {
        "en": "Receiving the repeater output does not prove your transmitted signal is set up correctly. The offset and transmit access tone still matter on the input side.",
        "fr": null
      }
    },
    {
      "id": "QZ-L-002-01-A-C3",
      "prompt": {
        "en": "A 20-metre voice operator is set to lower sideband and hears an existing contact only about 2 kHz away. Which combined correction fits the lesson?",
        "fr": null
      },
      "choices": [
        {
          "text": {
            "en": "Use the 20-metre upper-sideband convention and choose a spot with about 3 kHz or more from the contact.",
            "fr": null
          },
          "isCorrect": true
        },
        {
          "text": {
            "en": "Keep lower sideband because moving closer than 3 kHz makes the wrong sideband easier to copy.",
            "fr": null
          },
          "isCorrect": false
        },
        {
          "text": {
            "en": "Stay 2 kHz away if the other station is weak, because sideband convention replaces spacing courtesy.",
            "fr": null
          },
          "isCorrect": false
        },
        {
          "text": {
            "en": "Switch to a repeater offset, because offset programming provides SSB separation on HF.",
            "fr": null
          },
          "isCorrect": false
        }
      ],
      "explanation": {
        "en": "The operator must satisfy both ideas: use the expected 20-metre sideband and leave enough SSB spacing from the contact already in progress.",
        "fr": null
      }
    }
  ]
}
